[
  {
    "source_id": "S01",
    "title": "Precision Optics",
    "authors_or_organization": [
      "Bühler Leybold Optics"
    ],
    "source_type": "official_manual",
    "year": 2018,
    "version_or_edition": "PDF metadata creation 2018-05-08; 44 pages",
    "doi": null,
    "url": "https://dam.buhlergroup.com/asset/5a2a255493ef47d49158daae54c1f037/Brochure_LO_Optics_Precision%20Optics.pdf",
    "accessed_at_utc": "2026-10-01",
    "topic_ids": [
      "T01"
    ],
    "evidence_level": "A",
    "read_status": "partial",
    "summary_path": "sources/abstracts/source_summaries.md#s01",
    "original_path": "sources/originals/S01_Buhler_Precision_Optics.pdf",
    "original_sha256": "08b7328b1beaefc4f35398027977093e321bbe84133b6e45866c727d629a5943",
    "rights": {
      "status": "restricted",
      "license": null,
      "basis": "来源官方公开下载或专利公开下载入口；按用户研究存档请求保存单份原始文件，不声称开放再分发许可。",
      "archive_allowed": true,
      "redistribution_allowed": false,
      "redistribution_basis": "未核实再分发许可，用户交付包默认不包含原始文件。"
    },
    "conditions": {
      "scope": "设备结构及建模接口，不代表用户实机或普适性能",
      "read_scope": "full_text_selected_pages",
      "original_source_type": "manufacturer_brochure"
    },
    "claims": [
      {
        "claim_id": "S01-C1",
        "statement": "设备提供行星、球冠等不同装夹选项，并集成热蒸发、电子枪、辅助源与监控。适合作为部件识别索引；选件与宣传性能不代表用户实机。",
        "locator": "第8、11–12页；对照第16–17页",
        "verification_status": "reported",
        "limitations": [
          "厂家历史手册；未核对当前报价或用户设备选装清单。"
        ]
      }
    ],
    "limitations": [
      "厂家历史手册；未核对当前报价或用户设备选装清单。"
    ],
    "conflicts": [],
    "record_version": 1,
    "standard_metadata": null
  },
  {
    "source_id": "S02",
    "title": "scia Opto 300 product flyer",
    "authors_or_organization": [
      "scia Systems"
    ],
    "source_type": "official_manual",
    "year": 2021,
    "version_or_edition": "09/2021; 2 pages",
    "doi": null,
    "url": "https://www.scia-systems.com/fileadmin/user_upload/products/pdf/PI_scia_Opto_300.pdf",
    "accessed_at_utc": "2026-10-01",
    "topic_ids": [
      "T01"
    ],
    "evidence_level": "A",
    "read_status": "full",
    "summary_path": "sources/abstracts/source_summaries.md#s02",
    "original_path": "sources/originals/S02_scia_Opto300.pdf",
    "original_sha256": "0ea21039bbb382f1380fae022b02054de8c0076a5cb4c012b0377ae91153b6c8",
    "rights": {
      "status": "restricted",
      "license": null,
      "basis": "来源官方公开下载或专利公开下载入口；按用户研究存档请求保存单份原始文件，不声称开放再分发许可。",
      "archive_allowed": true,
      "redistribution_allowed": false,
      "redistribution_basis": "未核实再分发许可，用户交付包默认不包含原始文件。"
    },
    "conditions": {
      "scope": "设备结构及建模接口，不代表用户实机或普适性能",
      "read_scope": "full_text",
      "original_source_type": "manufacturer_brochure"
    },
    "claims": [
      {
        "claim_id": "S02-C1",
        "statement": "IBS/DIBS示意将主离子源、靶鼓、辅助源及旋转工件分开。用于说明膜料来自靶面；其均匀性采用σ/mean口径，不能与峰谷值直接比较。",
        "locator": "第1–2页",
        "verification_status": "reported",
        "limitations": [
          "仅用于邻近架构对照，不把该单转设备称为用户行星蒸发机。"
        ]
      }
    ],
    "limitations": [
      "仅用于邻近架构对照，不把该单转设备称为用户行星蒸发机。"
    ],
    "conflicts": [],
    "record_version": 1,
    "standard_metadata": null
  },
  {
    "source_id": "S03",
    "title": "Optical Coating Systems data sheet",
    "authors_or_organization": [
      "Dynavac"
    ],
    "source_type": "official_manual",
    "year": null,
    "version_or_edition": null,
    "doi": null,
    "url": "https://dynavac.com/wp-content/uploads/2024/11/Dynavac-Optical-Coating-Systems-data-sheet.pdf",
    "accessed_at_utc": "2026-10-01",
    "topic_ids": [
      "T01"
    ],
    "evidence_level": "C",
    "read_status": "partial",
    "summary_path": "sources/abstracts/source_summaries.md#s03",
    "original_path": null,
    "original_sha256": null,
    "rights": {
      "status": "restricted",
      "license": null,
      "basis": "作者/机构/厂家官方页面公开提供阅读；仅用必要摘要与链接。",
      "archive_allowed": null,
      "redistribution_allowed": false,
      "redistribution_basis": "未核实再分发许可，用户交付包默认不包含原始文件。"
    },
    "conditions": {
      "scope": "设备结构及建模接口，不代表用户实机或普适性能",
      "read_scope": "indexed_excerpt",
      "original_source_type": "manufacturer_brochure"
    },
    "claims": [
      {
        "claim_id": "S03-C1",
        "statement": "列出平面/球冠单转、平面/可变角度行星夹具及晶控/光控选项。说明同一设备系列可有多种夹具。",
        "locator": "第3页公开索引",
        "verification_status": "reported",
        "limitations": [
          "原始文件下载403；仅依据公开索引内容，不声称阅读全文。"
        ]
      }
    ],
    "limitations": [
      "原始文件下载403；仅依据公开索引内容，不声称阅读全文。"
    ],
    "conflicts": [],
    "record_version": 1,
    "standard_metadata": null
  },
  {
    "source_id": "S04",
    "title": "Dynavac Pioneers Water-Cooled Planetary Mechanism for Customer’s Thin-Film Deposition System",
    "authors_or_organization": [
      "Dynavac"
    ],
    "source_type": "manufacturer_case",
    "year": 2021,
    "version_or_edition": "2021-02-24",
    "doi": null,
    "url": "https://dynavac.com/wp-content/uploads/2024/11/Dynavac_Water_Cooled_Planetary_Mechanism.pdf",
    "accessed_at_utc": "2026-10-01",
    "topic_ids": [
      "T01"
    ],
    "evidence_level": "C",
    "read_status": "partial",
    "summary_path": "sources/abstracts/source_summaries.md#s04",
    "original_path": null,
    "original_sha256": null,
    "rights": {
      "status": "restricted",
      "license": null,
      "basis": "作者/机构/厂家官方页面公开提供阅读；仅用必要摘要与链接。",
      "archive_allowed": null,
      "redistribution_allowed": false,
      "redistribution_basis": "未核实再分发许可，用户交付包默认不包含原始文件。"
    },
    "conditions": {
      "scope": "设备结构及建模接口，不代表用户实机或普适性能",
      "read_scope": "indexed_excerpt",
      "original_source_type": "manufacturer_case_study"
    },
    "claims": [
      {
        "claim_id": "S04-C1",
        "statement": "报道为温敏与厚膜工件开发水冷行星，并需便于冷却/非冷却配置切换。作为热管理接口线索，不能替代长期可靠性数据。",
        "locator": "公开新闻正文索引",
        "verification_status": "reported",
        "limitations": [
          "下载403；用户配置与性能未核实。"
        ]
      }
    ],
    "limitations": [
      "下载403；用户配置与性能未核实。"
    ],
    "conflicts": [],
    "record_version": 1,
    "standard_metadata": null
  },
  {
    "source_id": "S05",
    "title": "Water cooled planetary system",
    "authors_or_organization": [
      "Pollara; Chandrasekaran; Foley / Vacuum Technology Associates"
    ],
    "source_type": "other",
    "year": 2023,
    "version_or_edition": "US11608882B2; published 2023-03-21",
    "doi": null,
    "url": "https://patents.google.com/patent/US11608882B2/en",
    "accessed_at_utc": "2026-10-01",
    "topic_ids": [
      "T01"
    ],
    "evidence_level": "A",
    "read_status": "partial",
    "summary_path": "sources/abstracts/source_summaries.md#s05",
    "original_path": "sources/originals/S05_US11608882.pdf",
    "original_sha256": "456e4feb0ff6443782d3b33d25e903d16f6056197ca639194483caeb84b7d8bb",
    "rights": {
      "status": "restricted",
      "license": null,
      "basis": "来源官方公开下载或专利公开下载入口；按用户研究存档请求保存单份原始文件，不声称开放再分发许可。",
      "archive_allowed": true,
      "redistribution_allowed": false,
      "redistribution_basis": "未核实再分发许可，用户交付包默认不包含原始文件。"
    },
    "conditions": {
      "scope": "设备结构及建模接口，不代表用户实机或普适性能",
      "read_scope": "full_text_and_selected_figures",
      "original_source_type": "patent"
    },
    "claims": [
      {
        "claim_id": "S05-C1",
        "statement": "公开固定轴、主旋转接头、行星旋转接头和冷却夹套的集成路径。适合识别旋转水路、齿轮及支承接口；专利性能陈述不是独立测试。",
        "locator": "Detailed Description; figures 1–3; PDF 8 pages",
        "verification_status": "reported",
        "limitations": [
          "仅结构研究；未做权利要求有效性或自由实施分析。"
        ]
      }
    ],
    "limitations": [
      "仅结构研究；未做权利要求有效性或自由实施分析。"
    ],
    "conflicts": [],
    "record_version": 1,
    "standard_metadata": null
  },
  {
    "source_id": "S06",
    "title": "Uniformity Masks Design Method Based on the Shadow Matrix for Coating Materials with Different Condensation Characteristics",
    "authors_or_organization": [
      "Lichao Zhang; Xikun Cai"
    ],
    "source_type": "primary_paper",
    "year": 2013,
    "version_or_edition": "The Scientific World Journal 2013:160792",
    "doi": "10.1155/2013/160792",
    "url": "https://pmc.ncbi.nlm.nih.gov/articles/PMC3817662/",
    "accessed_at_utc": "2026-10-01",
    "topic_ids": [
      "T01"
    ],
    "evidence_level": "A",
    "read_status": "full",
    "summary_path": "sources/abstracts/source_summaries.md#s06",
    "original_path": null,
    "original_sha256": null,
    "rights": {
      "status": "open_licensed",
      "license": "Creative Commons Attribution (exact version not specified in article notice)",
      "basis": "PMC文章Copyright and License information明确授权署名转载。",
      "archive_allowed": true,
      "redistribution_allowed": true,
      "redistribution_basis": "保留作者、原题、DOI与许可声明；本批实际未取得可用PDF。"
    },
    "conditions": {
      "scope": "设备结构及建模接口，不代表用户实机或普适性能",
      "read_scope": "full_text_html",
      "original_source_type": "journal_article"
    },
    "claims": [
      {
        "claim_id": "S06-C1",
        "statement": "开放研究分别拟合材料发射/凝结响应，并在球面行星夹具上验证修正板。支持材料相关遮挡接口；其参数只属于文中工艺。",
        "locator": "Theory and Experiment; Results and discussion; license paragraph",
        "verification_status": "reported",
        "limitations": [
          "CC Attribution已核实；PDF下载返回非PDF，尚未存档原文文件。"
        ]
      }
    ],
    "limitations": [
      "CC Attribution已核实；PDF下载返回非PDF，尚未存档原文文件。"
    ],
    "conflicts": [],
    "record_version": 1,
    "standard_metadata": null
  },
  {
    "source_id": "S07",
    "title": "IMC300 Operating Manual 074-786-P1A",
    "authors_or_organization": [
      "INFICON"
    ],
    "source_type": "official_manual",
    "year": null,
    "version_or_edition": "074-786-P1A",
    "doi": null,
    "url": "https://www.inficon.com/media/12124/download/Zevision-IMC300-Operating-Manual.pdf?language=en&v=1",
    "accessed_at_utc": "2026-10-01",
    "topic_ids": [
      "T01"
    ],